<?xml version="1.0" encoding="UTF-8"?>
<!DOCTYPE list SYSTEM "item.dtd">
<list>
	<etcitem id="20728" name="Scroll: Summon Lucky Lamp">
		<set name="mailable" value="false"/>
		<set name="clan_warehouseable" value="false"/>
		<set name="reuse_delay" value="14400000"/>
		<set name="is_olympiad_can_use" value="false"/>
		<set name="sellable" value="false"/>
		<set name="privatestoreable" value="false"/>
		<set name="dropable" value="false"/>
		<set name="tradeable" value="false"/>
		<set name="icon" value="BranchSys.icon.br_lamp_orange_i00"/>
		<set name="stackable" value="true"/>
		<set name="crystal_type" value="NONE"/>
	</etcitem>
	<armor id="20792" name="Flavorful Cheese Hat - Not Available" add_name="Not Available">
		<set name="is_olympiad_can_use" value="false"/>
		<set name="sellable" value="false"/>
		<set name="crystal_type" value="NONE"/>
		<set name="icon" value="icon.etc_ertheia2"/>
		<set name="type" value="NONE"/>
		<set name="weight" value="10"/>
		<equip>
			<slot id="HAIR_ALL"/>
		</equip>
	</armor>
	<armor id="20793" name="Sweet Cheese Hat - Not Available" add_name="Not Available">
		<set name="is_olympiad_can_use" value="false"/>
		<set name="sellable" value="false"/>
		<set name="crystal_type" value="NONE"/>
		<set name="icon" value="icon.etc_ertheia2"/>
		<set name="type" value="NONE"/>
		<set name="weight" value="10"/>
		<equip>
			<slot id="HAIR_ALL"/>
		</equip>
	</armor>
</list>