<?xml version="1.0" encoding="UTF-8"?>
<!DOCTYPE list SYSTEM "item.dtd">
<list>
	<etcitem id="6569" name="Protecting Scroll: Enchant A-grade Weapon">
		<set name="is_olympiad_can_use" value="false"/>
		<set name="icon" value="icon.etc_blessed_scrl_of_ench_wp_a_i04"/>
		<set name="type" value="SCROLL_ENCHANT_WEAPON"/>
		<set name="crystal_type" value="NONE"/>
		<set name="stackable" value="true"/>
		<set name="weight" value="0"/>
	</etcitem>
	<etcitem id="6570" name="Protecting Scroll: Enchant A-grade Armor">
		<set name="is_olympiad_can_use" value="false"/>
		<set name="icon" value="icon.etc_blessed_scrl_of_ench_am_a_i04"/>
		<set name="type" value="SCROLL_ENCHANT_ARMOR"/>
		<set name="crystal_type" value="NONE"/>
		<set name="stackable" value="true"/>
		<set name="weight" value="0"/>
	</etcitem>
	<etcitem id="6571" name="Protecting Scroll: Enchant B-grade Weapon">
		<set name="is_olympiad_can_use" value="false"/>
		<set name="sellable" value="false"/>
		<set name="type" value="SCROLL_ENCHANT_WEAPON"/>
		<set name="crystal_type" value="NONE"/>
		<set name="icon" value="icon.etc_blessed_scrl_of_ench_wp_b_i03"/>
		<set name="stackable" value="true"/>
		<set name="weight" value="0"/>
	</etcitem>
	<etcitem id="6572" name="Protecting Scroll: Enchant B-grade Armor">
		<set name="is_olympiad_can_use" value="false"/>
		<set name="sellable" value="false"/>
		<set name="type" value="SCROLL_ENCHANT_ARMOR"/>
		<set name="crystal_type" value="NONE"/>
		<set name="icon" value="icon.etc_blessed_scrl_of_ench_am_b_i03"/>
		<set name="stackable" value="true"/>
		<set name="weight" value="0"/>
	</etcitem>
	<etcitem id="6573" name="Protecting Scroll: Enchant C-grade Weapon">
		<set name="is_olympiad_can_use" value="false"/>
		<set name="sellable" value="false"/>
		<set name="type" value="SCROLL_ENCHANT_WEAPON"/>
		<set name="crystal_type" value="NONE"/>
		<set name="icon" value="icon.etc_blessed_scrl_of_ench_wp_c_i02"/>
		<set name="stackable" value="true"/>
		<set name="weight" value="0"/>
	</etcitem>
	<etcitem id="6574" name="Protecting Scroll: Enchant C-grade Armor">
		<set name="is_olympiad_can_use" value="false"/>
		<set name="sellable" value="false"/>
		<set name="type" value="SCROLL_ENCHANT_ARMOR"/>
		<set name="crystal_type" value="NONE"/>
		<set name="icon" value="icon.etc_blessed_scrl_of_ench_am_c_i02"/>
		<set name="stackable" value="true"/>
		<set name="weight" value="0"/>
	</etcitem>
	<etcitem id="6575" name="Protecting Scroll: Enchant D-grade Weapon">
		<set name="is_olympiad_can_use" value="false"/>
		<set name="sellable" value="false"/>
		<set name="type" value="SCROLL_ENCHANT_WEAPON"/>
		<set name="crystal_type" value="NONE"/>
		<set name="icon" value="icon.etc_blessed_scrl_of_ench_wp_d_i01"/>
		<set name="stackable" value="true"/>
		<set name="weight" value="0"/>
	</etcitem>
	<etcitem id="6576" name="Protecting Scroll: Enchant D-grade Armor">
		<set name="is_olympiad_can_use" value="false"/>
		<set name="sellable" value="false"/>
		<set name="type" value="SCROLL_ENCHANT_ARMOR"/>
		<set name="crystal_type" value="NONE"/>
		<set name="icon" value="icon.etc_blessed_scrl_of_ench_am_d_i01"/>
		<set name="stackable" value="true"/>
		<set name="weight" value="0"/>
	</etcitem>
	<etcitem id="6577" name="Protecting Scroll: Enchant S-grade Weapon">
		<set name="grind_commission" value="300000"/>
		<set name="grind_point" value="15000000"/>
		<set name="price" value="30000000"/>
		<set name="type" value="SCROLL_ENCHANT_WEAPON"/>
		<set name="icon" value="icon.etc_blessed_scrl_of_ench_wp_s_i05"/>
		<set name="weight" value="0"/>
		<set name="stackable" value="true"/>
		<set name="crystal_type" value="NONE"/>
	</etcitem>
	<etcitem id="6578" name="Protecting Scroll: Enchant S-grade Armor">
		<set name="grind_commission" value="45000"/>
		<set name="grind_point" value="2250000"/>
		<set name="price" value="4500000"/>
		<set name="type" value="SCROLL_ENCHANT_ARMOR"/>
		<set name="icon" value="icon.etc_blessed_scrl_of_ench_am_s_i05"/>
		<set name="weight" value="0"/>
		<set name="stackable" value="true"/>
		<set name="crystal_type" value="NONE"/>
	</etcitem>
	<weapon id="6579" name="Arcana Mace">
		<set name="freightable" value="true"/>
		<set name="random_damage" value="19"/>
		<set name="grind_commission" value="427594"/>
		<set name="grind_point" value="21379700"/>
		<set name="damage_range" value="0;0;40;120"/>
		<set name="variation_group_id" value="2"/>
		<set name="is_magic_weapon" value="true"/>
		<set name="price" value="42759400"/>
		<set name="crystal_count" value="1368"/>
		<set name="crystal_type" value="S"/>
		<set name="icon" value="icon.weapon_arcana_mace_i00"/>
		<set name="type" value="BLUNT"/>
		<set name="weight" value="1300"/>
		<set name="soulshots" value="4"/>
		<set name="spiritshots" value="4"/>
		<set name="rnd_dam" value="19"/>
		<equip>
			<slot id="RIGHT_HAND"/>
		</equip>
		<for>
			<add stat="pAtk" order="0x10" value="225"/>
			<add stat="mAtk" order="0x10" value="201"/>
			<set stat="basePAtkSpd" order="0x08" value="379"/>
			<set stat="basePCritRate" order="0x08" value="60"/>
			<add stat="pAccCombat" order="0x10" value="8"/>
		</for>
	</weapon>
	<weapon id="6580" name="Tallum Blade*Dark Legion's Edge">
		<set name="freightable" value="true"/>
		<set name="random_damage" value="10"/>
		<set name="grind_commission" value="427594"/>
		<set name="grind_point" value="21379700"/>
		<set name="damage_range" value="0;0;44;120"/>
		<set name="variation_group_id" value="2"/>
		<set name="crystal_count" value="1368"/>
		<set name="crystal_type" value="S"/>
		<set name="icon" value="icon.weapon_dual_sword_i00"/>
		<set name="price" value="42759400"/>
		<set name="type" value="DUAL"/>
		<set name="weight" value="2080"/>
		<set name="soulshots" value="4"/>
		<set name="spiritshots" value="4"/>
		<set name="rnd_dam" value="10"/>
		<equip>
			<slot id="LEFT_RIGHT_HAND"/>
		</equip>
		<for>
			<add stat="pAtk" order="0x10" value="342"/>
			<add stat="mAtk" order="0x10" value="151"/>
			<set stat="basePAtkSpd" order="0x08" value="325"/>
			<set stat="basePCritRate" order="0x08" value="80"/>
		</for>
	</weapon>
</list>