<?xml version="1.0" encoding="UTF-8"?>
<!DOCTYPE list SYSTEM "item.dtd">
<list>
	<armor id="37533" name="NC Messenger's Hat" add_name="Sealed">
		<set name="freightable" value="true"/>
		<set name="mailable" value="false"/>
		<set name="clan_warehouseable" value="false"/>
		<set name="sellable" value="false"/>
		<set name="privatestoreable" value="false"/>
		<set name="dropable" value="false"/>
		<set name="tradeable" value="false"/>
		<set name="crystal_type" value="NONE"/>
		<set name="icon" value="icon.nc_hair_acc"/>
		<set name="type" value="NONE"/>
		<equip>
			<slot id="HAIR_ALL"/>
		</equip>
	</armor>
	<armor id="37534" name="Santa Outfit" add_name="Sealed">
		<set name="mailable" value="false"/>
		<set name="clan_warehouseable" value="false"/>
		<set name="sellable" value="false"/>
		<set name="privatestoreable" value="false"/>
		<set name="dropable" value="false"/>
		<set name="tradeable" value="false"/>
		<set name="crystal_type" value="NONE"/>
		<set name="icon" value="icon.armor_ev_santas_clothes"/>
		<set name="type" value="HEAVY"/>
		<equip>
			<slot id="FORMAL_WEAR"/>
		</equip>
	</armor>
	<armor id="37535" name="Santa Hat" add_name="Sealed">
		<set name="mailable" value="false"/>
		<set name="clan_warehouseable" value="false"/>
		<set name="sellable" value="false"/>
		<set name="privatestoreable" value="false"/>
		<set name="dropable" value="false"/>
		<set name="tradeable" value="false"/>
		<set name="crystal_type" value="NONE"/>
		<set name="icon" value="icon.accessory_santas_cap_i00"/>
		<set name="type" value="NONE"/>
		<equip>
			<slot id="HAIR_ALL"/>
		</equip>
	</armor>
	<etcitem id="37543" name="Snowy Squash Nectar">
		<set name="is_olympiad_can_use" value="false"/>
		<set name="handler" value="SkillsReduce"/>
		<set name="sellable" value="false"/>
		<set name="icon" value="icon.etc_nectar_i01"/>
		<set name="stackable" value="true"/>
		<set name="crystal_type" value="NONE"/>
		<skills>
			<skill id="17110" level="1"/>	<!--Нектар Снежной Тыквы-->
		</skills>
	</etcitem>
	<etcitem id="37544" name="Snowball">
		<set name="sellable" value="false"/>
		<set name="icon" value="BranchSys2.icon.g_illumination_white"/>
		<set name="stackable" value="true"/>
		<set name="crystal_type" value="NONE"/>
	</etcitem>
	<etcitem id="37545" name="Large Snowball">
		<set name="sellable" value="false"/>
		<set name="icon" value="BranchSys2.icon.g_illumination_white"/>
		<set name="stackable" value="true"/>
		<set name="crystal_type" value="NONE"/>
	</etcitem>
	<etcitem id="37546" name="Rudolph's Gift 2015" add_name="Lv. 1">
		<set name="icon" value="icon.etc_pi_gift_box_i04"/>
		<set name="weight" value="10"/>
		<set name="stackable" value="true"/>
		<set name="crystal_type" value="NONE"/>
	</etcitem>
	<etcitem id="37547" name="Rudolph's Gift 2015" add_name="Lv. 2">
		<set name="icon" value="icon.etc_pi_gift_box_i04"/>
		<set name="weight" value="10"/>
		<set name="stackable" value="true"/>
		<set name="crystal_type" value="NONE"/>
	</etcitem>
	<etcitem id="37548" name="Rudolph's Gift 2015" add_name="Lv. 3">
		<set name="icon" value="icon.etc_pi_gift_box_i04"/>
		<set name="weight" value="10"/>
		<set name="stackable" value="true"/>
		<set name="crystal_type" value="NONE"/>
	</etcitem>
	<etcitem id="37549" name="Rudolph's Gift 2015" add_name="Lv. 4">
		<set name="icon" value="icon.etc_pi_gift_box_i04"/>
		<set name="weight" value="10"/>
		<set name="stackable" value="true"/>
		<set name="crystal_type" value="NONE"/>
	</etcitem>
	<etcitem id="37550" name="Snowman's Buff">
		<set name="icon" value="icon.weapon_snowman_stick_i00"/>
		<set name="weight" value="120"/>
		<set name="stackable" value="true"/>
		<set name="crystal_type" value="NONE"/>
	</etcitem>
	<etcitem id="37551" name="Christmas Present">
		<set name="sellable" value="false"/>
		<set name="icon" value="icon.etc_pi_gift_box_i04"/>
		<set name="stackable" value="true"/>
		<set name="crystal_type" value="NONE"/>
	</etcitem>
	<etcitem id="37552" name="Snowy Squash Seed">
		<set name="handler" value="SkillsReduce"/>
		<set name="icon" value="icon.etc_gourd_i10"/>
		<set name="stackable" value="true"/>
		<set name="crystal_type" value="NONE"/>
		<skills>
			<skill id="17111" level="1"/>	<!-- Семечко Снежной Тыквы-->
		</skills>
	</etcitem>
	<etcitem id="37553" name="Large Snowy Squash Seed">
		<set name="handler" value="SkillsReduce"/>
		<set name="icon" value="icon.etc_gourd_i11"/>
		<set name="stackable" value="true"/>
		<set name="crystal_type" value="NONE"/>
		<skills>
			<skill id="17112" level="1"/>	<!-- Семечко Снежной Большой Тыквы-->
		</skills>
	</etcitem>
</list>