<?xml version="1.0" encoding="UTF-8"?>
<!DOCTYPE list SYSTEM "item.dtd">
<list>
	<etcitem id="34070" name="Scroll: Enchant C-grade Weapon" add_name="Sealed">
		<set name="mailable" value="false"/>
		<set name="clan_warehouseable" value="false"/>
		<set name="is_olympiad_can_use" value="false"/>
		<set name="sellable" value="false"/>
		<set name="privatestoreable" value="false"/>
		<set name="dropable" value="false"/>
		<set name="tradeable" value="false"/>
		<set name="icon" value="icon.etc_scroll_of_enchant_weapon_i02"/>
		<set name="weight" value="0"/>
		<set name="stackable" value="true"/>
		<set name="crystal_type" value="NONE"/>
		<set name="type" value="SCROLL_ENCHANT_WEAPON"/>
	</etcitem>
	<etcitem id="34072" name="Scroll: Enchant D-grade Weapon" add_name="Sealed">
		<set name="mailable" value="false"/>
		<set name="clan_warehouseable" value="false"/>
		<set name="is_olympiad_can_use" value="false"/>
		<set name="sellable" value="false"/>
		<set name="privatestoreable" value="false"/>
		<set name="dropable" value="false"/>
		<set name="tradeable" value="false"/>
		<set name="icon" value="icon.etc_scroll_of_enchant_weapon_i01"/>
		<set name="weight" value="0"/>
		<set name="stackable" value="true"/>
		<set name="crystal_type" value="NONE"/>
		<set name="type" value="SCROLL_ENCHANT_WEAPON"/>
	</etcitem>
</list>